{
  "requestId": "sketchup-poc-action-04b8e453fb5e",
  "kind": "sketchup-poc-action",
  "createdAtUtc": "2026-04-09T21:58:07Z",
  "status": "pending",
  "payload": {
    "action": "extract-model-snapshot",
    "probeMode": "probe-first",
    "fallbackMode": "mock-sample",
    "snapshotOutputPath": "C:\\OpenClaw\\SketchUpPoC\\model-snapshot.json",
    "responseArtifactPath": "C:\\OpenClaw\\SketchUpPoC\\extract-model-response.json",
    "options": {
      "documentName": "office-demo.skp",
      "documentPath": "C:\\Projects\\office-demo.skp",
      "sketchupExePath": "C:\\Program Files\\SketchUp\\SketchUp 2025\\SketchUp.exe"
    },
    "liveExtractorMode": "execute-bootstrap-ack"
  }
}
